{"schema_version":1,"event_id":"0199d0a4-6c1e-7cc2-9a51-3f1f2b9d8e11","idempotency_key":"0b8e2c7e5f3c1a9d4e6f8a0b2c4d6e8f0a1b3c5d7e9f1a2b4c6d8e0f2a4b6c8d","source":"coingecko","endpoint":"coins_markets","request":{"path":"/coins/markets","params":{"order":"market_cap_desc","page":"1","per_page":"100","vs_currency":"usd"}},"fetched_at":"2026-10-10T10:02:33.120Z","outcome":"ok","http":{"status":200,"latency_ms":412,"date":"Sat, 10 Oct 2026 10:02:33 GMT","age_s":null,"cf_cache_status":"MISS","etag":"W/\"c4924cc46ddaa91ee4660396b13c9c63\"","retry_after_s":null},"error":null,"payload_sha256":"9f86d081884c7d659a2feaa0c55ad015a3bf4f1b2b0b822cd15d6c15b0f00a08","payload":[{"id":"bitcoin","symbol":"btc","name":"Bitcoin","current_price":82776,"market_cap":1663572458130,"last_updated":"2026-10-10T10:07:55.000Z"}]}
