{"schema_version":1,"event_id":"0199d0a5-0a00-7000-8000-000000000001","idempotency_key":"0b8e2c7e5f3c1a9d4e6f8a0b2c4d6e8f0a1b3c5d7e9f1a2b4c6d8e0f2a4b6c8d","source":"coingecko","endpoint":"coin_detail","request":{"path":"/coins/bitcoin","params":{"localization":"false","tickers":"true"}},"fetched_at":"2026-10-10T10:02:48.000Z","outcome":"ok","http":{"status":200,"latency_ms":95,"date":null,"age_s":12,"cf_cache_status":"HIT","etag":null,"retry_after_s":null},"error":null,"payload_sha256":"9f86d081884c7d659a2feaa0c55ad015a3bf4f1b2b0b822cd15d6c15b0f00a08","payload":{"id":"bitcoin","market_data":{"market_cap":{"vnd":43083803721443304}}}}
